smartctl 6.1 2013-03-16 r3800 [ppc-linux-2.6.16-V05] (local build)
Copyright (C) 2002-13, Bruce Allen, Christian Franke, www.smartmontools.org

=== START OF READ SMART DATA SECTION ===
SMART Attributes Data Structure revision number: 10
Vendor Specific SMART Attributes with Thresholds:
ID# ATTRIBUTE_NAME          FLAG     VALUE WORST THRESH TYPE      UPDATED  WHEN_FAILED RAW_VALUE
  1 Raw_Read_Error_Rate     0x0033   120   120   050    Pre-fail  Always       -       0/0
  5 Retired_Block_Count     0x0033   100   100   003    Pre-fail  Always       -       0
  9 Power_On_Hours_and_Msec 0x0032   100   100   000    Old_age   Always       -       131h+00m+38.530s
 12 Power_Cycle_Count       0x0032   100   100   000    Old_age   Always       -       525
 13 Soft_Read_Error_Rate    0x0032   120   120   000    Old_age   Always       -       213/0
100 Gigabytes_Erased        0x0032   000   000   000    Old_age   Always       -       4294275447
170 Reserve_Block_Count     0x00ef   000   000   000    Pre-fail  Always       -       138240
171 Program_Fail_Count      0x000a   000   000   000    Old_age   Always       -       0
172 Erase_Fail_Count        0x0032   000   000   000    Old_age   Always       -       0
174 Unexpect_Power_Loss_Ct  0x0030   000   000   000    Old_age   Offline      -       525
177 Wear_Range_Delta        0x0000   000   000   000    Old_age   Offline      -       0
181 Program_Fail_Count      0x000a   000   000   000    Old_age   Always       -       0
182 Erase_Fail_Count        0x0032   000   000   000    Old_age   Always       -       0
184 IO_Error_Detect_Code_Ct 0x0000   100   100   090    Old_age   Offline      -       0
187 Reported_Uncorrect      0x001c   100   100   000    Old_age   Offline      -       0
194 Temperature_Celsius     0x0022   251   073   000    Old_age   Always       -       251 (0 235 0 73 0)
195 ECC_Uncorr_Error_Count  0x001c   100   100   000    Old_age   Offline      -       0/0
196 Reallocated_Event_Count 0x0033   100   100   003    Pre-fail  Always       -       0
198 Uncorrectable_Sector_Ct 0x0010   120   120   000    Old_age   Offline      -       0/0
199 SATA_CRC_Error_Count    0x0004   200   200   000    Old_age   Offline      -       0
201 Unc_Soft_Read_Err_Rate  0x001c   100   100   000    Old_age   Offline      -       0/0
204 Soft_ECC_Correct_Rate   0x001c   100   100   000    Old_age   Offline      -       0/0
230 Life_Curve_Status       0x0013   100   100   000    Pre-fail  Always       -       100
231 SSD_Life_Left           0x0013   100   100   010    Pre-fail  Always       -       0
232 Available_Reservd_Space 0x0032   000   000   000    Old_age   Always       -       135
233 SandForce_Internal      0x0032   000   000   000    Old_age   Always       -       716
234 SandForce_Internal      0x0032   000   000   000    Old_age   Always       -       592
235 SuperCap_Health         0x0033   100   100   002    Pre-fail  Always       -       0
241 Lifetime_Writes_GiB     0x0032   000   000   000    Old_age   Always       -       592
242 Lifetime_Reads_GiB      0x0032   000   000   000    Old_age   Always       -       11

