smartctl 6.1 2013-03-16 r3800 [x86_64-linux-3.10.7-200.fc19.x86_64] (local build)
Copyright (C) 2002-13, Bruce Allen, Christian Franke, www.smartmontools.org

=== START OF READ SMART DATA SECTION ===
SMART Attributes Data Structure revision number: 16
Vendor Specific SMART Attributes with Thresholds:
ID# ATTRIBUTE_NAME          FLAG     VALUE WORST THRESH TYPE      UPDATED  WHEN_FAILED RAW_VALUE
  1 Raw_Read_Error_Rate     0x002f   200   200   051    Pre-fail  Always       -       0
  3 Spin_Up_Time            0x0027   183   179   021    Pre-fail  Always       -       1808
  4 Start_Stop_Count        0x0032   100   100   000    Old_age   Always       -       262
  5 Reallocated_Sector_Ct   0x0033   130   130   140    Pre-fail  Always   FAILING_NOW 554
  7 Seek_Error_Rate         0x002e   200   200   000    Old_age   Always       -       0
  9 Power_On_Hours          0x0032   097   097   000    Old_age   Always       -       2861
 10 Spin_Retry_Count        0x0032   100   100   051    Old_age   Always       -       0
 11 Calibration_Retry_Count 0x0032   100   100   000    Old_age   Always       -       0
 12 Power_Cycle_Count       0x0032   100   100   000    Old_age   Always       -       223
192 Power-Off_Retract_Count 0x0032   200   200   000    Old_age   Always       -       34
193 Load_Cycle_Count        0x0032   200   200   000    Old_age   Always       -       499
194 Temperature_Celsius     0x0022   121   103   000    Old_age   Always       -       26
196 Reallocated_Event_Count 0x0032   191   191   000    Old_age   Always       -       9
197 Current_Pending_Sector  0x0032   200   200   000    Old_age   Always       -       0
198 Offline_Uncorrectable   0x0030   100   253   000    Old_age   Offline      -       0
199 UDMA_CRC_Error_Count    0x0032   200   200   000    Old_age   Always       -       0
200 Multi_Zone_Error_Rate   0x0008   100   253   051    Old_age   Offline      -       0

