smartctl 6.1 2013-03-16 r3800 [x86_64-linux-3.10.7-200.fc19.x86_64] (local build)
Copyright (C) 2002-13, Bruce Allen, Christian Franke, www.smartmontools.org

=== START OF READ SMART DATA SECTION ===
SMART Attributes Data Structure revision number: 16
Vendor Specific SMART Attributes with Thresholds:
ID# ATTRIBUTE_NAME          FLAG     VALUE WORST THRESH TYPE      UPDATED  WHEN_FAILED RAW_VALUE
  1 Raw_Read_Error_Rate     0x000f   199   199   051    Pre-fail  Always       -       13392
  3 Spin_Up_Time            0x0003   191   186   021    Pre-fail  Always       -       1408
  4 Start_Stop_Count        0x0032   098   098   000    Old_age   Always       -       2170
  5 Reallocated_Sector_Ct   0x0033   198   198   140    Pre-fail  Always       -       12
  7 Seek_Error_Rate         0x000e   100   253   051    Old_age   Always       -       0
  9 Power_On_Hours          0x0032   099   099   000    Old_age   Always       -       1365
 10 Spin_Retry_Count        0x0013   100   100   051    Pre-fail  Always       -       0
 11 Calibration_Retry_Count 0x0012   100   100   051    Old_age   Always       -       0
 12 Power_Cycle_Count       0x0032   098   098   000    Old_age   Always       -       2170
192 Power-Off_Retract_Count 0x0032   198   198   000    Old_age   Always       -       2168
193 Load_Cycle_Count        0x0032   193   193   000    Old_age   Always       -       23924
194 Temperature_Celsius     0x0022   122   085   000    Old_age   Always       -       0 0 0 0 0 25
196 Reallocated_Event_Count 0x0032   188   188   000    Old_age   Always       -       12
197 Current_Pending_Sector  0x0012   198   197   000    Old_age   Always       -       119
198 Offline_Uncorrectable   0x0010   200   200   000    Old_age   Offline      -       0
199 UDMA_CRC_Error_Count    0x003e   200   200   000    Old_age   Always       -       0
200 Multi_Zone_Error_Rate   0x0009   200   113   051    Pre-fail  Offline      -       0

