smartctl 6.2 (build date Aug 23 2013) [x86_64-linux-3.10.9-200.fc19.x86_64] (local build)
Copyright (C) 2002-13, Bruce Allen, Christian Franke, www.smartmontools.org

=== START OF READ SMART DATA SECTION ===
SMART Attributes Data Structure revision number: 16
Vendor Specific SMART Attributes with Thresholds:
ID# ATTRIBUTE_NAME          FLAG     VALUE WORST THRESH TYPE      UPDATED  WHEN_FAILED RAW_VALUE
  1 Raw_Read_Error_Rate     0x002f   200   200   051    Pre-fail  Always       -       12
  3 Spin_Up_Time            0x0027   180   180   021    Pre-fail  Always       -       1983
  4 Start_Stop_Count        0x0032   100   100   000    Old_age   Always       -       55
  5 Reallocated_Sector_Ct   0x0033   200   200   140    Pre-fail  Always       -       0
  7 Seek_Error_Rate         0x002e   100   253   000    Old_age   Always       -       0
  9 Power_On_Hours          0x0032   100   100   000    Old_age   Always       -       342
 10 Spin_Retry_Count        0x0033   100   253   051    Pre-fail  Always       -       0
 11 Calibration_Retry_Count 0x0032   100   253   000    Old_age   Always       -       0
 12 Power_Cycle_Count       0x0032   100   100   000    Old_age   Always       -       54
192 Power-Off_Retract_Count 0x0032   200   200   000    Old_age   Always       -       53
193 Load_Cycle_Count        0x0032   200   200   000    Old_age   Always       -       7
194 Temperature_Celsius     0x0022   154   073   000    Old_age   Always       -       -7
196 Reallocated_Event_Count 0x0032   200   200   000    Old_age   Always       -       0
197 Current_Pending_Sector  0x0032   200   200   000    Old_age   Always       -       0
198 Offline_Uncorrectable   0x0030   100   253   000    Old_age   Offline      -       0
199 UDMA_CRC_Error_Count    0x0032   200   200   000    Old_age   Always       -       0
200 Multi_Zone_Error_Rate   0x0009   100   253   051    Pre-fail  Offline      -       0

